url,text
https://wenzeldaniel.com,"Daniel Wenzel, graphic and type design, specialised in utilizing animation-tools and code."
https://chevalvert.fr,"Chevalvert est un studio de design graphique, typographique et interactif."
http://christopherlacy.co.uk,"Designing, making and organising by Chris Lacy."
https://samuelhewitt.com,"Sam Hewitt, Human Interface Designer"
https://56.digital,A boutique design studio based in Toronto specializing in art direction and digital experiences.
https://www.aarongilmore.com,Aaron Gilmore is a designer and developer based in Ireland
https://www.absentees.co,Digital designer/developer based in Sydney NSW.
https://random.studio,"Random Studio is an experience design studio. We are an international team of visual artists, strategists and engineers who blur the boundaries between art, design and technology."
https://abcdinamo.com,"DINAMO is a Swiss design practice established by Johannes Breyer and Fabian Harb. We’re interested in the overlap between graphic design production,…"
https://robert-janes.com,Robert Janes is a Type Designer and Engineer.
https://www.patrik-huebner.com,"Generative Design and Creative Coding for brands, agencies and cultural institutions. A fusion of storytelling, experience and branding with algorithms, human interaction, data, artificial intelligence and programming."
https://hanli.eu,"Hanzer Liccini, Studio for graphic design and typography"
https://waf.gmbh,WAF GMBH proposes a more effective model for designing and implementing digital platforms.
https://timrausch.de,Tim Rausch is a hamburg based graphic design and code writer
https://markfromberg.com,"Typeface Design, Type, Python, Programming, Tool, Development, Letters, Lettering, Illustration, Graphic Design, Corporate Design, Book Design, Typography"
https://www.field.systems,"FIELD.SYSTEMS, art and technology, generative design, interactive installation, brand art, generative brand design system"
https://www.gabischillig.de,"Gabi Schillig, Architecture, Communication Design, Conceptual Design, Spaces of Communication, Exhibition, Material, Research, Dialogical Spaces, Professor, Spatial Design, Berlin, Düsseldorf"
http://roxaboxen.us,Roxaboxen is a California-based design studio specializing in typefaces and identity systems.
https://www.quality-wolves.com,Our company provides high-quality design and development services. We specialize in creating innovative and marketable products that help businesses grow.
https://matthewragan.com,Media Maker and Interactive System Designer
https://web3000.net,web3000 is a web design and development studio based in Berlin
https://andreasfaust.de,Andreas Faust is a Berlin-based Graphic and Type Designer and Web­developer. He works as Creative Director for the german Edition of Jacobin Magazine and is Partner at Open Foundry.
https://intmagic.com,"International Magic is an experience design studio, creating new modes of interaction and visual communication. We believe in the power to entertain and innovate for the next generation."
https://andirueckel.com,"aesthetics, computation, design, development, gestaltung, graphic, interaction, interface, new media, prototyping, research, typography, visual, web"
http://gregorfinger.de,"this site provides a quick overview of gregor finger as designer and creative technologist, some would call it art"
https://www.foreignobjects.net,"design, consultancy, NEW INC, MIT, Media Lab, ACT, decentralization, Kallirroi, Retzepi, Agnes Cameron, Ghantous, Zhexi, architecture, software"
https://merani.cc,"Media Artist, Creative Technologist and Designer from Berlin"
https://in-no-particular-order.info,"design, information design, graphic design, spreadsheet, innoparticularorer, in no particular order,"
https://maxitype.com,"Maxitype is a collaborative platform to encourage type design research. We offer retail and bespoke typefaces, paying special attention to contemporary visual languages and historical knowledge."
https://haukeirrgang.com,Designer and Typographer from Berlin
https://mtwtf.com,"MTWTF is a design studio that creates communication platforms for cultural, commercial, educational, and civic clients."
https://newtendency.com,Contemporary Design Furniture for Your Home and Office
https://www.lust.nl,"LUST / Typography, Design &amp; Propaganda. Graphic design studio in The Hague, Netherlands. Design philosophy revolves around Process-based Design, Information &amp; Interactive Systems, Communication Structures &amp; Networks."
https://n-m.world,"Neo-Metabolism is a planetary research, design and life practice."
https://grafik.co.nz,Designer / Developer
https://vinzenzaubry.com,Digital archive of media artist and designer Vinzenz Aubry.
https://alright.studio,"Since 2017, Alright Studio is a deliberate and dynamic, full-service creative agency with a design &amp; technology focus. Based in Brooklyn, NY operating globally."
https://studiodumbar.com,"Studio Dumbar/DEPT® is an international design agency specialised in visual branding and online branding, located in Rotterdam."
https://ttato.design,We work hand in hand with talented designers from around the world to create beautiful and timeless products.
https://taliacotton.com,"Talia Cotton is a designer, coder, and educator who specializes in the intersection of brand identities and technology. She is leads the design and development of data-driven and algorithmic brand identities and websites at Pentagram in New York City, and teaches Core Interaction at Parsons School of Design."
https://www.yonk.online,"Hello there! We are YONK, a 3D studio based in The Hague (NL). We specialise in using Virtual Reality sculpting software to create 3D character design and animations to be used in advertising, video clips, identity, face filters and a lot more. This tool has helped us develop a unique maximalist and whimsical style paired with tangible textures and vivid colours. We aim to create work that steers away from conventional 3D and is entirely playful, dream-like and sometimes, damn right weird!"
https://haha.services,A FULL SERVICE DESIGN AND DEVELOPEMENT STUDIO IN NYC
https://armarchitecture.com.au,"ARM Architecture is an award-winning architecture, urban design and interior design practice. We work around Australia and are known for our scholarship and creativity. We enrich our design work by incorporating aspects of each project’s culture, environment, history and character as well as its purpose. The outcomes are individual and distinctive. Each could exist nowhere else, and for nobody else."
https://www.metalab.com,"MetaLab helps some of the world’s top companies—like Slack and Google—design, build, and ship amazing products and services."
https://anthonyzukofsky.com,"ANTHONY ZUKOFSKY (b.1992) (he/him) is a graphic designer, educator and writer in New York, NY, building dynamic identity systems and interactive projects for..."
http://www.hansje.net,"Graphic designer Hansje van Halem (1978, pronunciation: [hans-yeh]) gathered recognition with her distinctive typography and geometric, almost psychedelic..."
http://hansje.net,"graphic design, typography, pattern, type"
https://portorocha.com,PORTO ROCHA is a New York-based design and branding agency developing creative and strategic work that engages deeply with the world we live in.
https://wildcosmos.studio,"Brand Strategy &nbsp; &nbsp;Graphic Design &nbsp; &nbsp;Community &nbsp; &nbsp; Wild Cosmos is a story-driven creative studio based in Malmö, Sweden.&nbsp; ( OUR..."
https://tautau.co,"Product Designer fluent with UX &amp; UI, running collaborative design workshops and user testing. Able to communicate design ideas and prototype with open web programming languages. Experienced in branding  and development of visual identities."
https://laurelschwulst.com,"Artist, writer, &amp; professor creating special environments for curiosity, learning, and reflecting. Currently teaching 'Graphic Design: Link' at Princeton."
http://www.pieterjangrandry.com,Berlin based graphic designer from Belgium
https://lydiawhite.info,"Lydia White is lead product designer at Tumblr, Inc in New York City. She also takes pictures and runs a half dome retreat called the Shell House."
http://www.createwithmalte.de,"Malte Weber is a Designer from Berlin. He is working at the intersection between Computer Science, Psychology and Design."
https://ewalthert.com,"Edgar Walthert's studio practice is typedesign while still maintaining a strong interest in graphic design. His strengths are at their best in combination, for instance, when a corporate identity benefits from a cutsom typeface."
https://dirk-erdmann.com,"Interaction Designer living in the quarantine world. Mostly motion, sonic and visual experiences. New Media student at the UdK Berlin."
https://studio-sml.com,"Studio S/M/L ist ein in Berlin ansässiges Gestaltungsbüro, spezialisiert auf Corporate Design, Editorial Design und kreative Designstrategien."
https://www.markuslerner.com,"Interaction Designer, Creative Coder"
https://y-u-k-i-k-o.com,"Yukiko is a Berlin-based creative agency specialising in creative direction, art direction, brand strategy, concept generation and graphic design for commercial and cultural clients alike."
https://2x4.org,"We develop brand strategy, content, and design systems for creative partners everywhere."
https://www.xxix.co,"Twenty Nine is a design and technology studio building brands, products, and experiences based mostly in New York City and Berlin."
https://localprojects.com,"Local Projects is an exhibition and media design firm for museums and public spaces. While innovation drives much of today’s design, we’re interested in creating projects that endure."
https://jansindler.com,"jansindler.com, Type, Jan, Šindler, Design, RoboFont, code, Czechia, Haag, Prague, Netherlands, KABK, Type and Media, TM, TM2020, Afrikola, Integra, rotor, variable, VTT, hinting"
https://troyleinster.com,Troy Leinster is an Australian typeface designer working in New York City.
https://nicholaschristowitz.com,Nicholas Christowitz is a graphic designer. He's one half of Http Studio and one third of Father Coffee. Berlin and busy.
https://mad.ac,"MAD designs and develops digital products. We're a team of strategists, designers and technologists that unlocks creative potential in progressive organisations."
https://http.studio,Design and development for glowing rectangles
https://www.hi-malta.com,This is Romina Malta's professional site. She is an art director with focus on illustration and sound design. 
http://www.wearecomposite.co,We design things that captivate and engage real people.
https://wkshps.com,"Wkshps is a multidisciplinary design workshop that crafts identities for art institutions, public spaces, non-profits, and global brands alike."
https://noideas.website,"No Ideas is a graphic design studio in Brooklyn, New York. We create identities, websites, printed matter, editorial design and art direction for commercial and cultural clients."
https://othermeans.us,Other Means is a graphic design studio in New York.
https://www.wearecollins.com,COLLINS is a brand experience design company based in New York and San Francisco.
https://buck.co,"BUCK is a global creative company that brings brands, stories, and experiences to life through art, design, and technology."
https://bewe.me,Design + programming
https://designsystems.international,Deeply technical design studio where communications meet systematic principles.
https://dashdigital.studio,"Designed to engage. Built to connect. Driven by research &amp; strategy, we're a digital design studio that helps reimagine how customers connect to your brand."
https://joschabruening.eu,This is the Portfolio of Joscha Bruening. He is a very good Designer. Some say even the best.
https://www.jonathansplitlog.com,"Jonathan Splitlog is a product designer and collaborator in Chicago, IL working at Instrument on interface design for Google. Work Interface Design"
https://underware.nl,"Zealotry wouldn’t be an inappropriate collective noun for Underware. They not only design typefaces, they live type — they educate about type, they publish about type, they talk about type, they want (and organise) others to talk about type."
https://bb.agency,"We are a full-service creative agency specialized in crafting human-centric digital experiences. Our process includes services such as branding, user experience and user interface design with frontend development and cms integration."
http://alexchavot.fr,"alex,Alex,ALEX,chavot,Chavot,CHAVOT,ENSBA,Lyon,portfolio,graphiste,graphisme,indépendant,indépendant,typo,typographie,typeface,graphic,design,poster,affiches,photo,photographie"
https://portfolio-dananthony.vercel.app,Web designer and front-end web developer
https://paperfox.com.au,Web Design | Web Development | Berlin | Melbourne
https://www.lo-ol.design,"LO-OL type is a studio specialised in Latin, Hangeul and visual design revolving around typography and type design. The studio is located in Geneva, Switzerland."
https://hottype.co,"Hot Type is a type foundry and design studio established by Marko Hrastovec. We design, produce and sell retail and custom typefaces."
https://www.typemates.com,"Passionate type designers nearby Hamburg and Munich. Black and white experts, distributing typefaces of our font collection and design exclusive Custom Fonts."
https://klim.co.nz,"Klim Type Foundry is an independent typeface design studio led by Kris Sowersby and is based in Wellington, New Zealand. We sell a wide range of fonts online and undertake custom typographic work for international clients."
https://www.typotheque.com,"Typotheque type foundry, get unique, high quality fonts for print and screens directly from the designers. We also create custom (bespoke) fonts for most world's languages."
https://processtypefoundry.com,"The Process Type Foundry is a small, internationally recognized typeface design studio based in the Twin Cities of Minneapolis and St. Paul, Minnesota."
https://order.design,"Order Type Foundry designs and releases practical typefaces for longterm applications. Research, intention, and detail define our process."
https://type.land,"Typeland is an independent type design studio based in London. We offer retail fonts exclusively through our own website. We also develop custom fonts, work on commissioned projects, and specialise in multi-script design and production."
https://mass-driver.com,Typeface design and font production studio. Mass-Driver works across disciplines to create high quality original fonts.
https://tipografia.com.ar,"I’m a designer that works between type and software, bringing solutions to type foundries and other designers by helping them to improve their productivity trough streamlined workflows and ad-hoc tools."
http://www.martijndeheer.nl,"Martijn de Heer is founder of â€“ and designer / creative coder at Apt Opt Out. Co-founder of SUSLIB. Coding teacher at the Royal Academy of Art, The Hague."
http://aptoptout.studio,"A cross-disciplinary design studio, based in The Hague"
https://www.deniselu.com,"denise lu, graphics, data visualization, data vis, maps, charts, gis, visual journalist, developer, data, washington post, new york times, northwestern university, design, code"
https://emilkowal.ski,"I'm a developer interested in design, currently building ui at Compound."
https://www.unwind.nl,"Unwind offers consulting, project management, technology and design in the field of new media."
https://janareddemann.de,Graphic design and development.
https://www.tyfromtheinternet.com,"Graphic design, type design, photography, and the occasional video production, in Ithaca, New York."
https://margothofmans.com,Visual Artist - 3D Designer - Photogrammetry
https://baubauwerk.com,"Hey, we're Baubauwerk, a branding &amp; design studio in Berlin.&nbsp;We build identities, we build websites and develop integrated communication through concept development, awesome creativity and outstanding graphic design."
https://mohanvadivel.com,"Product designer, building interface for software medium."
https://www.revolvertype.com,"Revolver Type Foundry - High quality fonts, lettering and custom type design."
https://www.typearture.com,"Typeface design that is more that it's visuals, Typearture merges fonts with concepts, culture, illustration, experiment and a touch a humor."
https://blazetype.eu,Type Design foundry | We design fonts for blazing hot projects!
https://max.dev,"Max Schoening is a software designer working on tools for thought, creative expression, and planet scale computing."
https://formal-settings.com,"Formal Settings is a type and graphic design studio specialising in editorial design, identity and type driven visual communication."
https://objekteunserertage.com,Designed in Berlin &amp; Made in Germany
https://wild.as,"We bring together innovation, design, technology and business strategy to build award-winning websites, apps, and digital content."
https://studiofreight.com,"A design studio built on principle. We grow brands by making them easy to understand and impossible to ignore. Our creative experts support with branding, art direction, strategy, web design, web development, packaging, copywriting, lettering, illustration, photography, murals, signage, video, and beyond."
https://combo.co,Combo is an independent branding and innovation agency using strategy and design to unlock what’s next.
https://tom.so,"Tom Hackshaw is a school teacher and designer from Hokkaido, Japan. Currently based in Tāmaki Makaurau, Aotearoa."
https://www.publictype.us,Public is a collective of typeface and graphic designers. We have a boundless interest in constructing form to communicate. We are for curious discovery. We are advocates for type design. We work on custom typefaces for companies of all shapes and sizes. We count on a better tomorrow. We are Public.
https://cosmicshelter.com,Cosmic Shelter is a creative hub and digital studio. At the crossroad of engineering and art. We design and produce digital experiences that provoke emotions through tech.
https://nurecas.com,"visual,interaction,innovator,electronics,programming,NFT,art,creativity,crypto art,blockchain,augmented reality,virtual reality,artificial intelligence,ai,3d,patent,artist,design,designer"
https://www.paragraph.design,"→ Paragraph is the multidisciplinary design practice of Oliver Matzner, focusing on Branding, Editorial and Generative Design.We create digital experiences and analog sensations with an holistic design approach."
https://laurenthorson.com,Lauren Thorson is a designer.
https://lynnsohn.com,"Lynn Oh is a graphic designer based in New York City focusing on brand identity, type design, motion graphics, editorial, and interaction design...."
https://www.ppolder.com,"Philipp Polder is a multidisciplinary designer, webdeveloper and consultant specializing in unconventional online presences"
http://www.alphabet-type.com,Alphabet Type is a font production and type technology studio from Berlin offering tools and services for type designers and foundries.
https://www.oooz.club,OOOZ is a multidisciplinary design club based in cologne. We love to design from 60 up to 1000 bpm.
http://christopherprinz.com,Christopher Prinz is an Omaha based industrial designer seeking to expose extreme and rarely visible possibilities of materials and processes associated with manufacturing and construction.
https://juno-hamburg.com,"JUNO is a design-driven branding agency for the digital age from Hamburg, Germany."
https://pg-webstudio.de,"Webdesign für Göttingen und Umgebung, ob Wordpress, Drupal, Grav, Contao oder Joomla, SEO...."
https://justified.studio,A design &amp; technology studio helping brands create impact.
https://lucaiiriti.com,"I’m a multidisciplinary designer and art director currently based in Berlin. Specialised in visual communication, I craft meaningful brands through effective ideas and strategic thinking."
https://erichu.info,Eric Hu studio is the creative consultancy and design practice of New York art director Eric Hu.
https://alotofmoving.parts,"A design studio that tells stories about complicated systems at the intersection of architecture, culture, and technology."
https://seththompson.org,"Seth Thompson is the principal of A Lot of Moving Parts, a design and technology studio. He lives in Brooklyn, NY."
https://baukevanderlaan.eu,"Bauke designs and develops publications, identities, typefaces and digital products."
https://field.io,"FIELD.IO is an Artistic Practice for Experimental Design in London. We combine art + technology to create immersive audio-visual experiences, and powerful new formats of visual communication."
https://field.systems,"FIELD.SYSTEMS is an Artistic Practice for Experimental Design in London. We combine art + technology to create immersive audio-visual experiences, and powerful new formats of visual communication."
https://luizzanotello.com,Media artist and designer
https://fonts.studiofeixen.ch,Studio Feixen Fonts is a type foundry founded by the Swiss design studio Studio Feixen.
https://christoph.koe.berlin,Type Design &amp; Font Engineering
https://justanotherfoundry.com,"Founded in 2004, Just Another Foundry is oper­ated by Tim Ahrens and Shoko Mugikura – a type designer and a typo­graph­er, respect­ively. Despite our unas­sum­ing name, we are uncom­monly skilled in the design and produc­tion of text and display fonts for print and screen. In addi­tion to devel­op­ing our retail library, we provide custom and custom­ised typefaces for small and large clients alike. As one of the first webfont providers, we consider on-screen use of our fonts as import­ant as print. Our exper­i­ence in dealing with licens­ing and tech­no­lo­gical issues of new media helps us develop the ideal font package for your project."
https://liuleslie.github.io,"Portfolio website of Leslie Liu, print and interaction designer."
https://eric.young.li,Eric Li is a designer and software engineer based in New York.
https://im-burrow.com,Burrow is a interdisciplinary design studio based in Berlin
https://javierunknos.com,"JAVIER UNKNOS is a multidisciplinary designer currently based between Madrid &amp; Valencia specialy focused on type design and visual comunication for wide range of international clients in diverse fields such cultural, art, fashion, music and audiovisual industries."
https://pavellaptev.github.io,Pavel Laptev — digital designer
http://charlielemaignan.com,Graphic &amp; interactive designer focused on motion and typography. For inquiries say hi@charlielemaignan.com
https://grantcuster.com,Designer and engineer focused on new and alternative interfaces.
https://arrowtype.com,Design and development for modern typography
https://typefaces.pizza,Pizza Typefaces is an independent type design foundry. We bake and distribute flavored and custom fonts.
https://atelier-e.net,Creative studio for experimental &amp; electronic media. Strong &amp; aesthetic background in digital art &amp; design in both the visual &amp; the auditive spectrum.
https://atelier-anchor.com,graphic &amp; typeface design studio in shanghai. we make typeface as A narrative.
https://www.schick-toikka.com,Schick Toikka is a type foundry and graphic design studio established in 2010 by Florian Schick and Lauri Toikka.
https://www.openpurpose.com,"International multidisciplinary design agency based in Stockholm, Sweden."
https://www.wayward.group,"Wayward runs a group of companies founded by designer, Blank."
https://www.greylarson.com,"Grey Larson is a graphic designer in Salt Lake City, Utah."
https://aftonkleingroup.com,"Afton Klein Group is a design agency that works with brands in industries including technology, sports, fashion, entertainment, architecture, and the cultural arts. We have a strong belief that design is a way of thinking; this is the methodology through which we establish visual and communication strategies to provide our clients with a clear voice within culture and the market."
https://www.tim-peters.net,"bureau, creation, service, creative, design, studio, object, image, design, CGI, 3D, fashion, jewellery, cultural, museums, museum, studio, agence, office, art, crea, Antwerp, Antwerpen, Belgium, graphic, illustration, ad, art direction, motion, cgi, render, imagery, Tim Peters, Tim, Peters, Hasselt, Modemuseum Hasselt, Pukkelpop, Atelier 11, Wouters &amp; Hendrix, Eastpak"
http://fahrio.com,Fahri Özkaramanlı - Visual Communitaction Designer.
https://shira-inbar.com,"Shira Inbar is an independent graphic designer and image maker with an edge of motion graphics, living and working in New York."
https://www.alyssax.com,"I'm Alyssa X, a designer, developer, and serial maker. I've built products with over 120K users, been 3 times a Product Hunt Maker of The Year finalist, featured on Fast Company, and more."
https://www.hamishsmyth.com,"Archive of designer Hamish Smyth: Partner at Order, co-founder of Standards Manual, and former associate partner at Pentagram."
https://tipospereira.com,Tipos Pereira is a Type Foundry from the Brazilian designer Marcelo Magalhães. 
https://bureau.cool,"A boutique design studio and digital partner. Bureau Cool develops bespoke solutions in close partnership with brands, artists or cultural institutions. The work spans from digital to physical and its intersection."
https://letterror.com,"Type design, lettering, tools"
https://silly.berlin,"We are a team of photographers, art directors and set designers. We develop concepts, construct sets and wrap our ideas in photos, videos and other visual output."
